[
  {
    "wordId": "food-01-almusal",
    "tagalog": "Almusal",
    "english": "Breakfast",
    "category": "food",
    "tags": ["meals"],
    "recommendedGrade": 1,
    "difficultyLevel": 1,
    "frequency": "high",
    "exampleSentenceTagalog": "Kain na tayo ng almusal.",
    "exampleSentenceEnglish": "Let's eat breakfast.",
    "pronunciationNotes": "al-mu-SAL",
    "culturalNotes": "",
    "excludeable": true
  },
  {
    "wordId": "food-02-tanghalian",
    "tagalog": "Tanghalian",
    "english": "Lunch",
    "category": "food",
    "tags": ["meals"],
    "recommendedGrade": 1,
    "difficultyLevel": 1,
    "frequency": "high",
    "exampleSentenceTagalog": "Oras na ng tanghalian.",
    "exampleSentenceEnglish": "It's lunchtime.",
    "pronunciationNotes": "tang-ha-LI-an",
    "culturalNotes": "",
    "excludeable": true
  },
  {
    "wordId": "food-03-hapunan",
    "tagalog": "Hapunan",
    "english": "Dinner",
    "category": "food",
    "tags": ["meals"],
    "recommendedGrade": 1,
    "difficultyLevel": 1,
    "frequency": "high",
    "exampleSentenceTagalog": "Handa na ang hapunan.",
    "exampleSentenceEnglish": "Dinner is ready.",
    "pronunciationNotes": "ha-pu-NAN",
    "culturalNotes": "",
    "excludeable": true
  },
  {
    "wordId": "food-04-meryenda",
    "tagalog": "Meryenda",
    "english": "Snacks / Merienda",
    "category": "food",
    "tags": ["meals"],
    "recommendedGrade": 1,
    "difficultyLevel": 2,
    "frequency": "high",
    "exampleSentenceTagalog": "May meryenda ba?",
    "exampleSentenceEnglish": "Is there merienda?",
    "pronunciationNotes": "me-RYEN-da",
    "culturalNotes": "Afternoon snack time is culturally important in the Philippines.",
    "excludeable": true
  },
  {
    "wordId": "food-05-gutom",
    "tagalog": "Gutom",
    "english": "Hungry",
    "category": "food",
    "tags": ["feelings", "daily-life"],
    "recommendedGrade": 1,
    "difficultyLevel": 1,
    "frequency": "high",
    "exampleSentenceTagalog": "Gutom na ako.",
    "exampleSentenceEnglish": "I'm hungry.",
    "pronunciationNotes": "gu-TOM",
    "culturalNotes": "",
    "excludeable": true
  },
  {
    "wordId": "food-06-uhaw",
    "tagalog": "Uhaw",
    "english": "Thirsty",
    "category": "food",
    "tags": ["feelings", "daily-life"],
    "recommendedGrade": 1,
    "difficultyLevel": 1,
    "frequency": "high",
    "exampleSentenceTagalog": "Uhaw na ako.",
    "exampleSentenceEnglish": "I'm thirsty.",
    "pronunciationNotes": "u-HAW",
    "culturalNotes": "",
    "excludeable": true
  },
  {
    "wordId": "food-07-kanin",
    "tagalog": "Kanin",
    "english": "Rice (cooked)",
    "category": "food",
    "tags": ["staple-food"],
    "recommendedGrade": 1,
    "difficultyLevel": 1,
    "frequency": "high",
    "exampleSentenceTagalog": "Marami pang kanin.",
    "exampleSentenceEnglish": "There's still a lot of rice.",
    "pronunciationNotes": "ka-NIN",
    "culturalNotes": "Central to Filipino meals.",
    "excludeable": true
  },
  {
    "wordId": "food-08-tubig",
    "tagalog": "Tubig",
    "english": "Water",
    "category": "food",
    "tags": ["drinks"],
    "recommendedGrade": 1,
    "difficultyLevel": 1,
    "frequency": "high",
    "exampleSentenceTagalog": "Bigyan mo ako ng tubig.",
    "exampleSentenceEnglish": "Give me some water.",
    "pronunciationNotes": "tu-BIG",
    "culturalNotes": "",
    "excludeable": true
  },
  {
    "wordId": "food-09-gatas",
    "tagalog": "Gatas",
    "english": "Milk",
    "category": "food",
    "tags": ["drinks"],
    "recommendedGrade": 1,
    "difficultyLevel": 1,
    "frequency": "high",
    "exampleSentenceTagalog": "Uminom ka ng gatas.",
    "exampleSentenceEnglish": "Drink some milk.",
    "pronunciationNotes": "ga-TAS",
    "culturalNotes": "",
    "excludeable": true
  },
  {
    "wordId": "food-10-masarap",
    "tagalog": "Masarap",
    "english": "Delicious!",
    "category": "food",
    "tags": ["expressions"],
    "recommendedGrade": 1,
    "difficultyLevel": 1,
    "frequency": "high",
    "exampleSentenceTagalog": "Masarap ang pagkain!",
    "exampleSentenceEnglish": "The food is delicious!",
    "pronunciationNotes": "ma-sa-RAP",
    "culturalNotes": "Very commonly used compliment for food.",
    "excludeable": true
  }
]