[
  {
    "wordId": "shapes-01-bilog",
    "tagalog": "Bilog",
    "english": "Circle",
    "category": "shapes",
    "tags": ["basic-shapes"],
    "recommendedGrade": 1,
    "difficultyLevel": 1,
    "frequency": "high",
    "exampleSentenceTagalog": "Bilog ang bola.",
    "exampleSentenceEnglish": "The ball is round.",
    "pronunciationNotes": "BI-log",
    "culturalNotes": "",
    "excludeable": true
  },
  {
    "wordId": "shapes-02-parisukat",
    "tagalog": "Parisukat",
    "english": "Square",
    "category": "shapes",
    "tags": ["basic-shapes"],
    "recommendedGrade": 1,
    "difficultyLevel": 2,
    "frequency": "high",
    "exampleSentenceTagalog": "Parisukat ang mesa.",
    "exampleSentenceEnglish": "The table is square.",
    "pronunciationNotes": "pa-ri-SU-kat",
    "culturalNotes": "",
    "excludeable": true
  },
  {
    "wordId": "shapes-03-tatsulok",
    "tagalog": "Tatsulok",
    "english": "Triangle",
    "category": "shapes",
    "tags": ["basic-shapes"],
    "recommendedGrade": 1,
    "difficultyLevel": 2,
    "frequency": "medium",
    "exampleSentenceTagalog": "Tatsulok ang sumbrero.",
    "exampleSentenceEnglish": "The hat is triangular.",
    "pronunciationNotes": "tat-SU-lok",
    "culturalNotes": "",
    "excludeable": true
  },
  {
    "wordId": "shapes-04-parihaba",
    "tagalog": "Parihaba",
    "english": "Rectangle",
    "category": "shapes",
    "tags": ["basic-shapes"],
    "recommendedGrade": 1,
    "difficultyLevel": 2,
    "frequency": "medium",
    "exampleSentenceTagalog": "Parihaba ang papel.",
    "exampleSentenceEnglish": "The paper is rectangular.",
    "pronunciationNotes": "pa-ri-HA-ba",
    "culturalNotes": "",
    "excludeable": true
  },
  {
    "wordId": "shapes-05-puso",
    "tagalog": "Puso",
    "english": "Heart",
    "category": "shapes",
    "tags": ["common-shapes"],
    "recommendedGrade": 1,
    "difficultyLevel": 1,
    "frequency": "high",
    "exampleSentenceTagalog": "Puso ang hugis.",
    "exampleSentenceEnglish": "It's heart-shaped.",
    "pronunciationNotes": "PU-so",
    "culturalNotes": "",
    "excludeable": true
  },
  {
    "wordId": "shapes-06-bituin",
    "tagalog": "Bituin",
    "english": "Star",
    "category": "shapes",
    "tags": ["common-shapes"],
    "recommendedGrade": 1,
    "difficultyLevel": 1,
    "frequency": "high",
    "exampleSentenceTagalog": "Bituin ang hugis.",
    "exampleSentenceEnglish": "It's star-shaped.",
    "pronunciationNotes": "bi-TU-in",
    "culturalNotes": "",
    "excludeable": true
  }
]