[
  {
    "wordId": "numbers-01-isa",
    "tagalog": "Isa",
    "english": "One",
    "category": "numbers",
    "tags": ["numbers-1-10", "counting"],
    "recommendedGrade": 1,
    "difficultyLevel": 1,
    "frequency": "high",
    "exampleSentenceTagalog": "May isa lang.",
    "exampleSentenceEnglish": "There is only one.",
    "pronunciationNotes": "EE-sa",
    "culturalNotes": "Basic counting word. Used constantly in daily life.",
    "excludeable": true
  },
  {
    "wordId": "numbers-02-dalawa",
    "tagalog": "Dalawa",
    "english": "Two",
    "category": "numbers",
    "tags": ["numbers-1-10", "counting"],
    "recommendedGrade": 1,
    "difficultyLevel": 1,
    "frequency": "high",
    "exampleSentenceTagalog": "Dalawa ang kapatid ko.",
    "exampleSentenceEnglish": "I have two siblings.",
    "pronunciationNotes": "da-LA-wa",
    "culturalNotes": "Very common in everyday counting.",
    "excludeable": true
  },
  {
    "wordId": "numbers-03-tatlo",
    "tagalog": "Tatlo",
    "english": "Three",
    "category": "numbers",
    "tags": ["numbers-1-10", "counting"],
    "recommendedGrade": 1,
    "difficultyLevel": 1,
    "frequency": "high",
    "exampleSentenceTagalog": "Tatlo kami sa bahay.",
    "exampleSentenceEnglish": "There are three of us at home.",
    "pronunciationNotes": "TAT-lo",
    "culturalNotes": "",
    "excludeable": true
  },
  {
    "wordId": "numbers-04-apat",
    "tagalog": "Apat",
    "english": "Four",
    "category": "numbers",
    "tags": ["numbers-1-10", "counting"],
    "recommendedGrade": 1,
    "difficultyLevel": 1,
    "frequency": "high",
    "exampleSentenceTagalog": "Apat na araw na.",
    "exampleSentenceEnglish": "It's been four days.",
    "pronunciationNotes": "A-pat",
    "culturalNotes": "",
    "excludeable": true
  },
  {
    "wordId": "numbers-05-lima",
    "tagalog": "Lima",
    "english": "Five",
    "category": "numbers",
    "tags": ["numbers-1-10", "counting"],
    "recommendedGrade": 1,
    "difficultyLevel": 1,
    "frequency": "high",
    "exampleSentenceTagalog": "Lima ang daliri ko.",
    "exampleSentenceEnglish": "I have five fingers.",
    "pronunciationNotes": "LI-ma",
    "culturalNotes": "",
    "excludeable": true
  },
  {
    "wordId": "numbers-06-anim",
    "tagalog": "Anim",
    "english": "Six",
    "category": "numbers",
    "tags": ["numbers-1-10", "counting"],
    "recommendedGrade": 1,
    "difficultyLevel": 2,
    "frequency": "medium",
    "exampleSentenceTagalog": "Anim na taon na siya.",
    "exampleSentenceEnglish": "He/she is six years old.",
    "pronunciationNotes": "A-nim",
    "culturalNotes": "",
    "excludeable": true
  },
  {
    "wordId": "numbers-07-pito",
    "tagalog": "Pito",
    "english": "Seven",
    "category": "numbers",
    "tags": ["numbers-1-10", "counting"],
    "recommendedGrade": 1,
    "difficultyLevel": 2,
    "frequency": "medium",
    "exampleSentenceTagalog": "Pito ang araw sa isang linggo.",
    "exampleSentenceEnglish": "There are seven days in a week.",
    "pronunciationNotes": "PI-to",
    "culturalNotes": "",
    "excludeable": true
  },
  {
    "wordId": "numbers-08-walo",
    "tagalog": "Walo",
    "english": "Eight",
    "category": "numbers",
    "tags": ["numbers-1-10", "counting"],
    "recommendedGrade": 1,
    "difficultyLevel": 2,
    "frequency": "medium",
    "exampleSentenceTagalog": "Walo ang oras ng tulog ko.",
    "exampleSentenceEnglish": "I sleep eight hours.",
    "pronunciationNotes": "WA-lo",
    "culturalNotes": "",
    "excludeable": true
  },
  {
    "wordId": "numbers-09-siyam",
    "tagalog": "Siyam",
    "english": "Nine",
    "category": "numbers",
    "tags": ["numbers-1-10", "counting"],
    "recommendedGrade": 1,
    "difficultyLevel": 2,
    "frequency": "medium",
    "exampleSentenceTagalog": "Siyam na buwan na.",
    "exampleSentenceEnglish": "It's been nine months.",
    "pronunciationNotes": "SI-yam",
    "culturalNotes": "",
    "excludeable": true
  },
  {
    "wordId": "numbers-10-sampu",
    "tagalog": "Sampu",
    "english": "Ten",
    "category": "numbers",
    "tags": ["numbers-1-10", "counting"],
    "recommendedGrade": 1,
    "difficultyLevel": 2,
    "frequency": "high",
    "exampleSentenceTagalog": "Sampu ang daliri ko.",
    "exampleSentenceEnglish": "I have ten fingers.",
    "pronunciationNotes": "SAM-pu",
    "culturalNotes": "Very commonly used when counting to ten.",
    "excludeable": true
  }
]