[
  {
    "wordId": "emotions-01-masaya",
    "tagalog": "Masaya",
    "english": "Happy",
    "category": "emotions",
    "tags": ["feelings"],
    "recommendedGrade": 1,
    "difficultyLevel": 1,
    "frequency": "high",
    "exampleSentenceTagalog": "Masaya ako ngayon.",
    "exampleSentenceEnglish": "I am happy today.",
    "pronunciationNotes": "ma-SA-ya",
    "culturalNotes": "",
    "excludeable": true
  },
  {
    "wordId": "emotions-02-malungkot",
    "tagalog": "Malungkot",
    "english": "Sad",
    "category": "emotions",
    "tags": ["feelings"],
    "recommendedGrade": 1,
    "difficultyLevel": 2,
    "frequency": "high",
    "exampleSentenceTagalog": "Malungkot siya.",
    "exampleSentenceEnglish": "He/she is sad.",
    "pronunciationNotes": "ma-lung-KOT",
    "culturalNotes": "",
    "excludeable": true
  },
  {
    "wordId": "emotions-03-galit",
    "tagalog": "Galit",
    "english": "Angry",
    "category": "emotions",
    "tags": ["feelings"],
    "recommendedGrade": 1,
    "difficultyLevel": 2,
    "frequency": "high",
    "exampleSentenceTagalog": "Galit siya sa akin.",
    "exampleSentenceEnglish": "He/she is angry at me.",
    "pronunciationNotes": "ga-LIT",
    "culturalNotes": "",
    "excludeable": true
  },
  {
    "wordId": "emotions-04-pagod",
    "tagalog": "Pagod",
    "english": "Tired",
    "category": "emotions",
    "tags": ["feelings", "daily-life"],
    "recommendedGrade": 1,
    "difficultyLevel": 1,
    "frequency": "high",
    "exampleSentenceTagalog": "Pagod na ako.",
    "exampleSentenceEnglish": "I'm tired.",
    "pronunciationNotes": "pa-GOD",
    "culturalNotes": "",
    "excludeable": true
  },
  {
    "wordId": "emotions-05-mainit",
    "tagalog": "Mainit",
    "english": "Hot",
    "category": "emotions",
    "tags": ["sensations"],
    "recommendedGrade": 1,
    "difficultyLevel": 1,
    "frequency": "high",
    "exampleSentenceTagalog": "Mainit ang panahon.",
    "exampleSentenceEnglish": "The weather is hot.",
    "pronunciationNotes": "ma-I-nit",
    "culturalNotes": "",
    "excludeable": true
  },
  {
    "wordId": "emotions-06-malamig",
    "tagalog": "Malamig",
    "english": "Cold",
    "category": "emotions",
    "tags": ["sensations"],
    "recommendedGrade": 1,
    "difficultyLevel": 1,
    "frequency": "high",
    "exampleSentenceTagalog": "Malamig ang tubig.",
    "exampleSentenceEnglish": "The water is cold.",
    "pronunciationNotes": "ma-la-MIG",
    "culturalNotes": "",
    "excludeable": true
  },
  {
    "wordId": "emotions-07-inaantok",
    "tagalog": "Inaantok",
    "english": "Sleepy",
    "category": "emotions",
    "tags": ["feelings"],
    "recommendedGrade": 1,
    "difficultyLevel": 2,
    "frequency": "high",
    "exampleSentenceTagalog": "Inaantok na ako.",
    "exampleSentenceEnglish": "I'm getting sleepy.",
    "pronunciationNotes": "i-na-an-TOK",
    "culturalNotes": "",
    "excludeable": true
  }
]