[
  {
    "wordId": "questions-01-ano-ito",
    "tagalog": "Ano ito?",
    "english": "What is this?",
    "category": "questions",
    "tags": ["question-words"],
    "recommendedGrade": 1,
    "difficultyLevel": 1,
    "frequency": "high",
    "exampleSentenceTagalog": "Ano ito?",
    "exampleSentenceEnglish": "What is this?",
    "pronunciationNotes": "A-no I-to",
    "culturalNotes": "",
    "excludeable": true
  },
  {
    "wordId": "questions-02-sino-siya",
    "tagalog": "Sino siya?",
    "english": "Who is he/she?",
    "category": "questions",
    "tags": ["question-words"],
    "recommendedGrade": 1,
    "difficultyLevel": 1,
    "frequency": "high",
    "exampleSentenceTagalog": "Sino siya?",
    "exampleSentenceEnglish": "Who is he/she?",
    "pronunciationNotes": "SI-no SI-ya",
    "culturalNotes": "",
    "excludeable": true
  },
  {
    "wordId": "questions-03-bakit",
    "tagalog": "Bakit?",
    "english": "Why?",
    "category": "questions",
    "tags": ["question-words"],
    "recommendedGrade": 1,
    "difficultyLevel": 1,
    "frequency": "high",
    "exampleSentenceTagalog": "Bakit?",
    "exampleSentenceEnglish": "Why?",
    "pronunciationNotes": "BA-kit",
    "culturalNotes": "",
    "excludeable": true
  },
  {
    "wordId": "questions-04-kailan",
    "tagalog": "Kailan?",
    "english": "When?",
    "category": "questions",
    "tags": ["question-words"],
    "recommendedGrade": 1,
    "difficultyLevel": 1,
    "frequency": "high",
    "exampleSentenceTagalog": "Kailan?",
    "exampleSentenceEnglish": "When?",
    "pronunciationNotes": "kai-LAN",
    "culturalNotes": "",
    "excludeable": true
  },
  {
    "wordId": "questions-05-saan",
    "tagalog": "Saan?",
    "english": "Where?",
    "category": "questions",
    "tags": ["question-words"],
    "recommendedGrade": 1,
    "difficultyLevel": 1,
    "frequency": "high",
    "exampleSentenceTagalog": "Saan?",
    "exampleSentenceEnglish": "Where?",
    "pronunciationNotes": "SA-an",
    "culturalNotes": "",
    "excludeable": true
  },
  {
    "wordId": "questions-06-paano",
    "tagalog": "Paano?",
    "english": "How?",
    "category": "questions",
    "tags": ["question-words"],
    "recommendedGrade": 1,
    "difficultyLevel": 2,
    "frequency": "high",
    "exampleSentenceTagalog": "Paano?",
    "exampleSentenceEnglish": "How?",
    "pronunciationNotes": "pa-A-no",
    "culturalNotes": "",
    "excludeable": true
  },
  {
    "wordId": "questions-07-magkano",
    "tagalog": "Magkano?",
    "english": "How much?",
    "category": "questions",
    "tags": ["question-words", "shopping"],
    "recommendedGrade": 1,
    "difficultyLevel": 2,
    "frequency": "high",
    "exampleSentenceTagalog": "Magkano po?",
    "exampleSentenceEnglish": "How much is it? (polite)",
    "pronunciationNotes": "mag-KA-no",
    "culturalNotes": "",
    "excludeable": true
  }
]