[
  {
    "wordId": "classroom-01-lapis",
    "tagalog": "Lapis",
    "english": "Pencil",
    "category": "school",
    "tags": ["classroom-objects"],
    "recommendedGrade": 1,
    "difficultyLevel": 1,
    "frequency": "high",
    "exampleSentenceTagalog": "May lapis ka ba?",
    "exampleSentenceEnglish": "Do you have a pencil?",
    "pronunciationNotes": "LA-pis",
    "culturalNotes": "",
    "excludeable": true
  },
  {
    "wordId": "classroom-02-libro",
    "tagalog": "Libro",
    "english": "Book",
    "category": "school",
    "tags": ["classroom-objects"],
    "recommendedGrade": 1,
    "difficultyLevel": 1,
    "frequency": "high",
    "exampleSentenceTagalog": "Buksan ang libro.",
    "exampleSentenceEnglish": "Open the book.",
    "pronunciationNotes": "LI-bro",
    "culturalNotes": "",
    "excludeable": true
  },
  {
    "wordId": "classroom-03-mesa",
    "tagalog": "Mesa",
    "english": "Table",
    "category": "school",
    "tags": ["classroom-objects"],
    "recommendedGrade": 1,
    "difficultyLevel": 1,
    "frequency": "high",
    "exampleSentenceTagalog": "Upo sa mesa.",
    "exampleSentenceEnglish": "Sit at the table.",
    "pronunciationNotes": "ME-sa",
    "culturalNotes": "",
    "excludeable": true
  },
  {
    "wordId": "classroom-04-papel",
    "tagalog": "Papel",
    "english": "Paper",
    "category": "school",
    "tags": ["classroom-objects"],
    "recommendedGrade": 1,
    "difficultyLevel": 1,
    "frequency": "high",
    "exampleSentenceTagalog": "Isulat sa papel.",
    "exampleSentenceEnglish": "Write on the paper.",
    "pronunciationNotes": "pa-PEL",
    "culturalNotes": "",
    "excludeable": true
  },
  {
    "wordId": "classroom-05-gunting",
    "tagalog": "Gunting",
    "english": "Scissors",
    "category": "school",
    "tags": ["classroom-objects"],
    "recommendedGrade": 1,
    "difficultyLevel": 2,
    "frequency": "medium",
    "exampleSentenceTagalog": "Gamitin ang gunting.",
    "exampleSentenceEnglish": "Use the scissors.",
    "pronunciationNotes": "GUN-ting",
    "culturalNotes": "",
    "excludeable": true
  }
]