[
  {
    "wordId": "polite-01-mabuti-naman",
    "tagalog": "Mabuti naman",
    "english": "I'm fine",
    "category": "greetings",
    "tags": ["polite-responses"],
    "recommendedGrade": 1,
    "difficultyLevel": 2,
    "frequency": "high",
    "exampleSentenceTagalog": "Mabuti naman, salamat.",
    "exampleSentenceEnglish": "I'm fine, thank you.",
    "pronunciationNotes": "ma-BU-ti NA-man",
    "culturalNotes": "Standard polite response to 'Kumusta'.",
    "excludeable": true
  },
  {
    "wordId": "polite-02-opo",
    "tagalog": "Opo",
    "english": "Yes (polite)",
    "category": "greetings",
    "tags": ["respect-language"],
    "recommendedGrade": 1,
    "difficultyLevel": 1,
    "frequency": "high",
    "exampleSentenceTagalog": "Opo, salamat po.",
    "exampleSentenceEnglish": "Yes, thank you (polite).",
    "pronunciationNotes": "O-po",
    "culturalNotes": "Respectful way to say 'yes' to elders.",
    "excludeable": true
  },
  {
    "wordId": "polite-03-hindi",
    "tagalog": "Hindi",
    "english": "No",
    "category": "greetings",
    "tags": ["basic-responses"],
    "recommendedGrade": 1,
    "difficultyLevel": 1,
    "frequency": "high",
    "exampleSentenceTagalog": "Hindi po.",
    "exampleSentenceEnglish": "No (polite).",
    "pronunciationNotes": "HIN-di",
    "culturalNotes": "",
    "excludeable": true
  },
  {
    "wordId": "polite-04-maraming-salamat",
    "tagalog": "Maraming salamat",
    "english": "Thank you very much",
    "category": "greetings",
    "tags": ["polite-expressions"],
    "recommendedGrade": 1,
    "difficultyLevel": 2,
    "frequency": "high",
    "exampleSentenceTagalog": "Maraming salamat po.",
    "exampleSentenceEnglish": "Thank you very much (polite).",
    "pronunciationNotes": "ma-RA-ming sa-LA-mat",
    "culturalNotes": "",
    "excludeable": true
  },
  {
    "wordId": "polite-05-walang-anuman",
    "tagalog": "Walang anuman",
    "english": "You're welcome",
    "category": "greetings",
    "tags": ["polite-responses"],
    "recommendedGrade": 1,
    "difficultyLevel": 2,
    "frequency": "high",
    "exampleSentenceTagalog": "Walang anuman.",
    "exampleSentenceEnglish": "You're welcome.",
    "pronunciationNotes": "wa-lang a-nu-MAN",
    "culturalNotes": "",
    "excludeable": true
  },
  {
    "wordId": "polite-06-paumanhin",
    "tagalog": "Paumanhin",
    "english": "I'm sorry / Excuse me",
    "category": "greetings",
    "tags": ["polite-expressions"],
    "recommendedGrade": 1,
    "difficultyLevel": 2,
    "frequency": "high",
    "exampleSentenceTagalog": "Paumanhin po.",
    "exampleSentenceEnglish": "I'm sorry / Excuse me (polite).",
    "pronunciationNotes": "pa-u-man-HIN",
    "culturalNotes": "",
    "excludeable": true
  }
]