[
  {
    "wordId": "days-01-lunes",
    "tagalog": "Lunes",
    "english": "Monday",
    "category": "time",
    "tags": ["days"],
    "recommendedGrade": 1,
    "difficultyLevel": 2,
    "frequency": "high",
    "exampleSentenceTagalog": "Lunes ngayon.",
    "exampleSentenceEnglish": "It's Monday today.",
    "pronunciationNotes": "LU-nes",
    "culturalNotes": "",
    "excludeable": true
  },
  {
    "wordId": "days-02-martes",
    "tagalog": "Martes",
    "english": "Tuesday",
    "category": "time",
    "tags": ["days"],
    "recommendedGrade": 1,
    "difficultyLevel": 2,
    "frequency": "high",
    "exampleSentenceTagalog": "Martes bukas.",
    "exampleSentenceEnglish": "Tomorrow is Tuesday.",
    "pronunciationNotes": "MAR-tes",
    "culturalNotes": "",
    "excludeable": true
  },
  {
    "wordId": "days-03-miyerkules",
    "tagalog": "Miyerkules",
    "english": "Wednesday",
    "category": "time",
    "tags": ["days"],
    "recommendedGrade": 1,
    "difficultyLevel": 2,
    "frequency": "high",
    "exampleSentenceTagalog": "Miyerkules ngayon.",
    "exampleSentenceEnglish": "It's Wednesday today.",
    "pronunciationNotes": "mi-yer-KU-les",
    "culturalNotes": "",
    "excludeable": true
  },
  {
    "wordId": "days-04-huwebes",
    "tagalog": "Huwebes",
    "english": "Thursday",
    "category": "time",
    "tags": ["days"],
    "recommendedGrade": 1,
    "difficultyLevel": 2,
    "frequency": "high",
    "exampleSentenceTagalog": "Huwebes bukas.",
    "exampleSentenceEnglish": "Tomorrow is Thursday.",
    "pronunciationNotes": "hu-WE-bes",
    "culturalNotes": "",
    "excludeable": true
  },
  {
    "wordId": "days-05-biyernes",
    "tagalog": "Biyernes",
    "english": "Friday",
    "category": "time",
    "tags": ["days"],
    "recommendedGrade": 1,
    "difficultyLevel": 2,
    "frequency": "high",
    "exampleSentenceTagalog": "Biyernes na bukas.",
    "exampleSentenceEnglish": "Tomorrow is Friday.",
    "pronunciationNotes": "bi-YER-nes",
    "culturalNotes": "",
    "excludeable": true
  },
  {
    "wordId": "days-06-sabado",
    "tagalog": "Sabado",
    "english": "Saturday",
    "category": "time",
    "tags": ["days"],
    "recommendedGrade": 1,
    "difficultyLevel": 1,
    "frequency": "high",
    "exampleSentenceTagalog": "Sabado ngayon.",
    "exampleSentenceEnglish": "It's Saturday today.",
    "pronunciationNotes": "sa-BA-do",
    "culturalNotes": "",
    "excludeable": true
  },
  {
    "wordId": "days-07-linggo",
    "tagalog": "Linggo",
    "english": "Sunday",
    "category": "time",
    "tags": ["days"],
    "recommendedGrade": 1,
    "difficultyLevel": 1,
    "frequency": "high",
    "exampleSentenceTagalog": "Linggo bukas.",
    "exampleSentenceEnglish": "Tomorrow is Sunday.",
    "pronunciationNotes": "LING-go",
    "culturalNotes": "",
    "excludeable": true
  }
]