[
  {
    "wordId": "animals-01-aso",
    "tagalog": "Aso",
    "english": "Dog",
    "category": "animals",
    "tags": ["pets", "common-animals"],
    "recommendedGrade": 1,
    "difficultyLevel": 1,
    "frequency": "high",
    "exampleSentenceTagalog": "May aso kami sa bahay.",
    "exampleSentenceEnglish": "We have a dog at home.",
    "pronunciationNotes": "A-so",
    "culturalNotes": "",
    "excludeable": true
  },
  {
    "wordId": "animals-02-pusa",
    "tagalog": "Pusa",
    "english": "Cat",
    "category": "animals",
    "tags": ["pets", "common-animals"],
    "recommendedGrade": 1,
    "difficultyLevel": 1,
    "frequency": "high",
    "exampleSentenceTagalog": "Ang pusa ay matulog.",
    "exampleSentenceEnglish": "The cat is sleeping.",
    "pronunciationNotes": "PU-sa",
    "culturalNotes": "",
    "excludeable": true
  },
  {
    "wordId": "animals-03-ibon",
    "tagalog": "Ibon",
    "english": "Bird",
    "category": "animals",
    "tags": ["common-animals"],
    "recommendedGrade": 1,
    "difficultyLevel": 1,
    "frequency": "high",
    "exampleSentenceTagalog": "Maraming ibon sa puno.",
    "exampleSentenceEnglish": "There are many birds in the tree.",
    "pronunciationNotes": "I-bon",
    "culturalNotes": "",
    "excludeable": true
  },
  {
    "wordId": "animals-04-isda",
    "tagalog": "Isda",
    "english": "Fish",
    "category": "animals",
    "tags": ["common-animals"],
    "recommendedGrade": 1,
    "difficultyLevel": 1,
    "frequency": "high",
    "exampleSentenceTagalog": "Mahilig kumain ng isda.",
    "exampleSentenceEnglish": "Likes to eat fish.",
    "pronunciationNotes": "IS-da",
    "culturalNotes": "",
    "excludeable": true
  },
  {
    "wordId": "animals-05-kalabaw",
    "tagalog": "Kalabaw",
    "english": "Carabao / Water buffalo",
    "category": "animals",
    "tags": ["farm-animals", "national-symbol"],
    "recommendedGrade": 2,
    "difficultyLevel": 2,
    "frequency": "medium",
    "exampleSentenceTagalog": "Malakas ang kalabaw.",
    "exampleSentenceEnglish": "The carabao is strong.",
    "pronunciationNotes": "ka-la-BAW",
    "culturalNotes": "National animal of the Philippines.",
    "excludeable": true
  },
  {
    "wordId": "animals-06-manok",
    "tagalog": "Manok",
    "english": "Chicken",
    "category": "animals",
    "tags": ["farm-animals"],
    "recommendedGrade": 1,
    "difficultyLevel": 1,
    "frequency": "high",
    "exampleSentenceTagalog": "May manok sa bakuran.",
    "exampleSentenceEnglish": "There are chickens in the yard.",
    "pronunciationNotes": "ma-NOK",
    "culturalNotes": "",
    "excludeable": true
  },
  {
    "wordId": "animals-07-baboy",
    "tagalog": "Baboy",
    "english": "Pig",
    "category": "animals",
    "tags": ["farm-animals"],
    "recommendedGrade": 1,
    "difficultyLevel": 1,
    "frequency": "high",
    "exampleSentenceTagalog": "Ang baboy ay mataba.",
    "exampleSentenceEnglish": "The pig is fat.",
    "pronunciationNotes": "ba-BOY",
    "culturalNotes": "",
    "excludeable": true
  }
]