[
  {
    "wordId": "expressions-01-mahal-kita",
    "tagalog": "Mahal kita",
    "english": "I love you",
    "category": "expressions",
    "tags": ["affection"],
    "recommendedGrade": 1,
    "difficultyLevel": 2,
    "frequency": "high",
    "exampleSentenceTagalog": "Mahal kita.",
    "exampleSentenceEnglish": "I love you.",
    "pronunciationNotes": "MA-hal KI-ta",
    "culturalNotes": "",
    "excludeable": true
  },
  {
    "wordId": "expressions-02-ingat-ka",
    "tagalog": "Ingat ka",
    "english": "Take care",
    "category": "expressions",
    "tags": ["care"],
    "recommendedGrade": 1,
    "difficultyLevel": 1,
    "frequency": "high",
    "exampleSentenceTagalog": "Ingat ka.",
    "exampleSentenceEnglish": "Take care.",
    "pronunciationNotes": "i-NGAT ka",
    "culturalNotes": "Very commonly used when saying goodbye.",
    "excludeable": true
  },
  {
    "wordId": "expressions-03-kaya-mo-yan",
    "tagalog": "Kaya mo ‘yan!",
    "english": "You can do it!",
    "category": "expressions",
    "tags": ["encouragement"],
    "recommendedGrade": 1,
    "difficultyLevel": 2,
    "frequency": "high",
    "exampleSentenceTagalog": "Kaya mo ‘yan!",
    "exampleSentenceEnglish": "You can do it!",
    "pronunciationNotes": "KA-ya mo yan",
    "culturalNotes": "",
    "excludeable": true
  },
  {
    "wordId": "expressions-04-namimiss-kita",
    "tagalog": "Nami-miss kita",
    "english": "I miss you",
    "category": "expressions",
    "tags": ["affection"],
    "recommendedGrade": 2,
    "difficultyLevel": 2,
    "frequency": "high",
    "exampleSentenceTagalog": "Nami-miss kita.",
    "exampleSentenceEnglish": "I miss you.",
    "pronunciationNotes": "na-mi-MISS ki-ta",
    "culturalNotes": "",
    "excludeable": true
  },
  {
    "wordId": "expressions-05-hanggang-sa-muli",
    "tagalog": "Hanggang sa muli",
    "english": "Until next time",
    "category": "expressions",
    "tags": ["goodbyes"],
    "recommendedGrade": 1,
    "difficultyLevel": 2,
    "frequency": "medium",
    "exampleSentenceTagalog": "Hanggang sa muli.",
    "exampleSentenceEnglish": "Until we meet again.",
    "pronunciationNotes": "hang-GANG sa mu-LI",
    "culturalNotes": "",
    "excludeable": true
  }
]