[
  {
    "wordId": "nature-01-araw",
    "tagalog": "Araw",
    "english": "Sun",
    "category": "nature",
    "tags": ["nature"],
    "recommendedGrade": 1,
    "difficultyLevel": 1,
    "frequency": "high",
    "exampleSentenceTagalog": "Maliwanag ang araw.",
    "exampleSentenceEnglish": "The sun is bright.",
    "pronunciationNotes": "A-raw",
    "culturalNotes": "",
    "excludeable": true
  },
  {
    "wordId": "nature-02-buwan",
    "tagalog": "Buwan",
    "english": "Moon",
    "category": "nature",
    "tags": ["nature"],
    "recommendedGrade": 1,
    "difficultyLevel": 1,
    "frequency": "high",
    "exampleSentenceTagalog": "Bilog ang buwan.",
    "exampleSentenceEnglish": "The moon is round.",
    "pronunciationNotes": "BU-wan",
    "culturalNotes": "",
    "excludeable": true
  },
  {
    "wordId": "nature-03-puno",
    "tagalog": "Puno",
    "english": "Tree",
    "category": "nature",
    "tags": ["nature"],
    "recommendedGrade": 1,
    "difficultyLevel": 1,
    "frequency": "high",
    "exampleSentenceTagalog": "Malaki ang puno.",
    "exampleSentenceEnglish": "The tree is big.",
    "pronunciationNotes": "PU-no",
    "culturalNotes": "",
    "excludeable": true
  },
  {
    "wordId": "nature-04-bulaklak",
    "tagalog": "Bulaklak",
    "english": "Flower",
    "category": "nature",
    "tags": ["nature"],
    "recommendedGrade": 1,
    "difficultyLevel": 1,
    "frequency": "high",
    "exampleSentenceTagalog": "Maganda ang bulaklak.",
    "exampleSentenceEnglish": "The flower is beautiful.",
    "pronunciationNotes": "bu-lak-LAK",
    "culturalNotes": "",
    "excludeable": true
  },
  {
    "wordId": "nature-05-dagat",
    "tagalog": "Dagat",
    "english": "Ocean / Sea",
    "category": "nature",
    "tags": ["nature"],
    "recommendedGrade": 1,
    "difficultyLevel": 1,
    "frequency": "high",
    "exampleSentenceTagalog": "Malawak ang dagat.",
    "exampleSentenceEnglish": "The ocean is wide.",
    "pronunciationNotes": "da-GAT",
    "culturalNotes": "",
    "excludeable": true
  },
  {
    "wordId": "nature-06-ulan",
    "tagalog": "Ulan",
    "english": "Rain",
    "category": "nature",
    "tags": ["nature", "weather"],
    "recommendedGrade": 1,
    "difficultyLevel": 1,
    "frequency": "high",
    "exampleSentenceTagalog": "Umuulan.",
    "exampleSentenceEnglish": "It's raining.",
    "pronunciationNotes": "U-lan",
    "culturalNotes": "",
    "excludeable": true
  }
]