[
  {
    "wordId": "family-01-ama",
    "tagalog": "Ama",
    "english": "Father",
    "category": "family",
    "tags": ["family-members", "respect-language"],
    "recommendedGrade": 1,
    "difficultyLevel": 1,
    "frequency": "high",
    "exampleSentenceTagalog": "Mahal ko ang aking ama.",
    "exampleSentenceEnglish": "I love my father.",
    "pronunciationNotes": "A-ma",
    "culturalNotes": "More formal/respectful than 'tatay'.",
    "excludeable": true
  },
  {
    "wordId": "family-02-ina",
    "tagalog": "Ina",
    "english": "Mother",
    "category": "family",
    "tags": ["family-members", "respect-language"],
    "recommendedGrade": 1,
    "difficultyLevel": 1,
    "frequency": "high",
    "exampleSentenceTagalog": "Mahal ko ang aking ina.",
    "exampleSentenceEnglish": "I love my mother.",
    "pronunciationNotes": "I-na",
    "culturalNotes": "More formal/respectful than 'nanay'.",
    "excludeable": true
  },
  {
    "wordId": "family-03-kapatid-lalaki",
    "tagalog": "Kapatid na lalaki",
    "english": "Brother",
    "category": "family",
    "tags": ["family-members"],
    "recommendedGrade": 1,
    "difficultyLevel": 2,
    "frequency": "high",
    "exampleSentenceTagalog": "May dalawang kapatid na lalaki ako.",
    "exampleSentenceEnglish": "I have two brothers.",
    "pronunciationNotes": "ka-PA-tid na la-LA-ki",
    "culturalNotes": "",
    "excludeable": true
  },
  {
    "wordId": "family-04-kapatid-babae",
    "tagalog": "Kapatid na babae",
    "english": "Sister",
    "category": "family",
    "tags": ["family-members"],
    "recommendedGrade": 1,
    "difficultyLevel": 2,
    "frequency": "high",
    "exampleSentenceTagalog": "May isang kapatid na babae ako.",
    "exampleSentenceEnglish": "I have one sister.",
    "pronunciationNotes": "ka-PA-tid na ba-BA-e",
    "culturalNotes": "",
    "excludeable": true
  },
  {
    "wordId": "family-05-kaibigan",
    "tagalog": "Kaibigan",
    "english": "Friend",
    "category": "family",
    "tags": ["social", "daily-life"],
    "recommendedGrade": 1,
    "difficultyLevel": 1,
    "frequency": "high",
    "exampleSentenceTagalog": "Best friend ko siya.",
    "exampleSentenceEnglish": "He/she is my best friend.",
    "pronunciationNotes": "ka-i-BI-gan",
    "culturalNotes": "",
    "excludeable": true
  },
  {
    "wordId": "family-06-kamag-anak",
    "tagalog": "Kamag-anak",
    "english": "Relative",
    "category": "family",
    "tags": ["family-members"],
    "recommendedGrade": 2,
    "difficultyLevel": 2,
    "frequency": "medium",
    "exampleSentenceTagalog": "Marami kaming kamag-anak.",
    "exampleSentenceEnglish": "We have many relatives.",
    "pronunciationNotes": "ka-mag-A-nak",
    "culturalNotes": "Very important concept in Filipino culture.",
    "excludeable": true
  }
]