[
  {
    "wordId": "colors-01-pula",
    "tagalog": "Pula",
    "english": "Red",
    "category": "colors",
    "tags": ["basic-colors"],
    "recommendedGrade": 1,
    "difficultyLevel": 1,
    "frequency": "high",
    "exampleSentenceTagalog": "Pula ang mansanas.",
    "exampleSentenceEnglish": "The apple is red.",
    "pronunciationNotes": "PU-la",
    "culturalNotes": "",
    "excludeable": true
  },
  {
    "wordId": "colors-02-dilaw",
    "tagalog": "Dilaw",
    "english": "Yellow",
    "category": "colors",
    "tags": ["basic-colors"],
    "recommendedGrade": 1,
    "difficultyLevel": 1,
    "frequency": "high",
    "exampleSentenceTagalog": "Dilaw ang araw.",
    "exampleSentenceEnglish": "The sun is yellow.",
    "pronunciationNotes": "di-LAW",
    "culturalNotes": "",
    "excludeable": true
  },
  {
    "wordId": "colors-03-asul",
    "tagalog": "Asul",
    "english": "Blue",
    "category": "colors",
    "tags": ["basic-colors"],
    "recommendedGrade": 1,
    "difficultyLevel": 1,
    "frequency": "high",
    "exampleSentenceTagalog": "Asul ang langit.",
    "exampleSentenceEnglish": "The sky is blue.",
    "pronunciationNotes": "A-sul",
    "culturalNotes": "",
    "excludeable": true
  },
  {
    "wordId": "colors-04-berde",
    "tagalog": "Berde",
    "english": "Green",
    "category": "colors",
    "tags": ["basic-colors"],
    "recommendedGrade": 1,
    "difficultyLevel": 1,
    "frequency": "high",
    "exampleSentenceTagalog": "Berde ang damo.",
    "exampleSentenceEnglish": "The grass is green.",
    "pronunciationNotes": "BER-de",
    "culturalNotes": "",
    "excludeable": true
  },
  {
    "wordId": "colors-05-puti",
    "tagalog": "Puti",
    "english": "White",
    "category": "colors",
    "tags": ["basic-colors"],
    "recommendedGrade": 1,
    "difficultyLevel": 1,
    "frequency": "high",
    "exampleSentenceTagalog": "Puti ang damit niya.",
    "exampleSentenceEnglish": "His/her clothes are white.",
    "pronunciationNotes": "PU-ti",
    "culturalNotes": "",
    "excludeable": true
  },
  {
    "wordId": "colors-06-itim",
    "tagalog": "Itim",
    "english": "Black",
    "category": "colors",
    "tags": ["basic-colors"],
    "recommendedGrade": 1,
    "difficultyLevel": 1,
    "frequency": "high",
    "exampleSentenceTagalog": "Itim ang buhok ko.",
    "exampleSentenceEnglish": "My hair is black.",
    "pronunciationNotes": "I-tim",
    "culturalNotes": "",
    "excludeable": true
  },
  {
    "wordId": "colors-07-rosas",
    "tagalog": "Rosas",
    "english": "Pink",
    "category": "colors",
    "tags": ["basic-colors"],
    "recommendedGrade": 1,
    "difficultyLevel": 2,
    "frequency": "medium",
    "exampleSentenceTagalog": "Rosas ang bulaklak.",
    "exampleSentenceEnglish": "The flower is pink.",
    "pronunciationNotes": "ro-SAS",
    "culturalNotes": "",
    "excludeable": true
  },
  {
    "wordId": "colors-08-kayumanggi",
    "tagalog": "Kayumanggi",
    "english": "Brown",
    "category": "colors",
    "tags": ["basic-colors"],
    "recommendedGrade": 2,
    "difficultyLevel": 3,
    "frequency": "medium",
    "exampleSentenceTagalog": "Kayumanggi ang balat niya.",
    "exampleSentenceEnglish": "His/her skin is brown.",
    "pronunciationNotes": "ka-yu-mang-GI",
    "culturalNotes": "Commonly used to describe skin tone.",
    "excludeable": true
  }
]