[
  {
    "wordId": "helpers-01-guro",
    "tagalog": "Guro",
    "english": "Teacher",
    "category": "community",
    "tags": ["helpers", "school"],
    "recommendedGrade": 1,
    "difficultyLevel": 1,
    "frequency": "high",
    "exampleSentenceTagalog": "Mahusay ang aming guro.",
    "exampleSentenceEnglish": "Our teacher is good.",
    "pronunciationNotes": "GU-ro",
    "culturalNotes": "",
    "excludeable": true
  },
  {
    "wordId": "helpers-02-pulis",
    "tagalog": "Pulis",
    "english": "Policeman / Police",
    "category": "community",
    "tags": ["helpers"],
    "recommendedGrade": 1,
    "difficultyLevel": 1,
    "frequency": "high",
    "exampleSentenceTagalog": "Tumawag ng pulis.",
    "exampleSentenceEnglish": "Call the police.",
    "pronunciationNotes": "PU-lis",
    "culturalNotes": "",
    "excludeable": true
  },
  {
    "wordId": "helpers-03-doktor",
    "tagalog": "Doktor",
    "english": "Doctor",
    "category": "community",
    "tags": ["helpers"],
    "recommendedGrade": 1,
    "difficultyLevel": 1,
    "frequency": "high",
    "exampleSentenceTagalog": "Kumonsulta sa doktor.",
    "exampleSentenceEnglish": "Consult the doctor.",
    "pronunciationNotes": "DOK-tor",
    "culturalNotes": "",
    "excludeable": true
  },
  {
    "wordId": "helpers-04-nars",
    "tagalog": "Nars",
    "english": "Nurse",
    "category": "community",
    "tags": ["helpers"],
    "recommendedGrade": 1,
    "difficultyLevel": 1,
    "frequency": "high",
    "exampleSentenceTagalog": "Mabait ang nars.",
    "exampleSentenceEnglish": "The nurse is kind.",
    "pronunciationNotes": "NARS",
    "culturalNotes": "",
    "excludeable": true
  },
  {
    "wordId": "helpers-05-magsasaka",
    "tagalog": "Magsasaka",
    "english": "Farmer",
    "category": "community",
    "tags": ["helpers"],
    "recommendedGrade": 2,
    "difficultyLevel": 2,
    "frequency": "medium",
    "exampleSentenceTagalog": "Masipag ang magsasaka.",
    "exampleSentenceEnglish": "The farmer is hardworking.",
    "pronunciationNotes": "mag-sa-SA-ka",
    "culturalNotes": "",
    "excludeable": true
  }
]