[
  {
    "wordId": "activities-01-takbo",
    "tagalog": "Takbo",
    "english": "Run",
    "category": "activities",
    "tags": ["daily-activities"],
    "recommendedGrade": 1,
    "difficultyLevel": 1,
    "frequency": "high",
    "exampleSentenceTagalog": "Takbo ka na!",
    "exampleSentenceEnglish": "Run!",
    "pronunciationNotes": "TAK-bo",
    "culturalNotes": "",
    "excludeable": true
  },
  {
    "wordId": "activities-02-talon",
    "tagalog": "Talon",
    "english": "Jump",
    "category": "activities",
    "tags": ["daily-activities"],
    "recommendedGrade": 1,
    "difficultyLevel": 1,
    "frequency": "high",
    "exampleSentenceTagalog": "Talon ka!",
    "exampleSentenceEnglish": "Jump!",
    "pronunciationNotes": "TA-lon",
    "culturalNotes": "",
    "excludeable": true
  },
  {
    "wordId": "activities-03-sayaw",
    "tagalog": "Sayaw",
    "english": "Dance",
    "category": "activities",
    "tags": ["daily-activities"],
    "recommendedGrade": 1,
    "difficultyLevel": 1,
    "frequency": "high",
    "exampleSentenceTagalog": "Sumayaw ka.",
    "exampleSentenceEnglish": "Dance.",
    "pronunciationNotes": "sa-YAW",
    "culturalNotes": "",
    "excludeable": true
  },
  {
    "wordId": "activities-04-kanta",
    "tagalog": "Kanta",
    "english": "Sing",
    "category": "activities",
    "tags": ["daily-activities"],
    "recommendedGrade": 1,
    "difficultyLevel": 1,
    "frequency": "high",
    "exampleSentenceTagalog": "Kumanta ka.",
    "exampleSentenceEnglish": "Sing.",
    "pronunciationNotes": "KAN-ta",
    "culturalNotes": "",
    "excludeable": true
  },
  {
    "wordId": "activities-05-maglaro",
    "tagalog": "Maglaro",
    "english": "Play",
    "category": "activities",
    "tags": ["daily-activities"],
    "recommendedGrade": 1,
    "difficultyLevel": 1,
    "frequency": "high",
    "exampleSentenceTagalog": "Maglaro tayo.",
    "exampleSentenceEnglish": "Let's play.",
    "pronunciationNotes": "mag-LA-ro",
    "culturalNotes": "",
    "excludeable": true
  },
  {
    "wordId": "activities-06-kain",
    "tagalog": "Kain",
    "english": "Eat",
    "category": "activities",
    "tags": ["daily-activities"],
    "recommendedGrade": 1,
    "difficultyLevel": 1,
    "frequency": "high",
    "exampleSentenceTagalog": "Kain na tayo.",
    "exampleSentenceEnglish": "Let's eat.",
    "pronunciationNotes": "KA-in",
    "culturalNotes": "",
    "excludeable": true
  },
  {
    "wordId": "activities-07-inom",
    "tagalog": "Inom",
    "english": "Drink",
    "category": "activities",
    "tags": ["daily-activities"],
    "recommendedGrade": 1,
    "difficultyLevel": 1,
    "frequency": "high",
    "exampleSentenceTagalog": "Uminom ka.",
    "exampleSentenceEnglish": "Drink.",
    "pronunciationNotes": "I-nom",
    "culturalNotes": "",
    "excludeable": true
  },
  {
    "wordId": "activities-08-tulog",
    "tagalog": "Tulog",
    "english": "Sleep",
    "category": "activities",
    "tags": ["daily-activities"],
    "recommendedGrade": 1,
    "difficultyLevel": 1,
    "frequency": "high",
    "exampleSentenceTagalog": "Matulog ka na.",
    "exampleSentenceEnglish": "Go to sleep.",
    "pronunciationNotes": "TU-log",
    "culturalNotes": "",
    "excludeable": true
  },
  {
    "wordId": "activities-09-magbasa",
    "tagalog": "Magbasa",
    "english": "Read",
    "category": "activities",
    "tags": ["daily-activities", "school"],
    "recommendedGrade": 1,
    "difficultyLevel": 2,
    "frequency": "high",
    "exampleSentenceTagalog": "Magbasa ka.",
    "exampleSentenceEnglish": "Read.",
    "pronunciationNotes": "mag-BA-sa",
    "culturalNotes": "",
    "excludeable": true
  },
  {
    "wordId": "activities-10-magsulat",
    "tagalog": "Magsulat",
    "english": "Write",
    "category": "activities",
    "tags": ["daily-activities", "school"],
    "recommendedGrade": 1,
    "difficultyLevel": 2,
    "frequency": "high",
    "exampleSentenceTagalog": "Magsulat ka.",
    "exampleSentenceEnglish": "Write.",
    "pronunciationNotes": "mag-su-LAT",
    "culturalNotes": "",
    "excludeable": true
  }
]