[
  {
    "wordId": "months-01-enero",
    "tagalog": "Enero",
    "english": "January",
    "category": "time",
    "tags": ["months"],
    "recommendedGrade": 2,
    "difficultyLevel": 2,
    "frequency": "medium",
    "exampleSentenceTagalog": "Enero ang unang buwan.",
    "exampleSentenceEnglish": "January is the first month.",
    "pronunciationNotes": "E-ne-ro",
    "culturalNotes": "",
    "excludeable": true
  },
  {
    "wordId": "months-02-pebrero",
    "tagalog": "Pebrero",
    "english": "February",
    "category": "time",
    "tags": ["months"],
    "recommendedGrade": 2,
    "difficultyLevel": 2,
    "frequency": "medium",
    "exampleSentenceTagalog": "Pebrero ang ikalawang buwan.",
    "exampleSentenceEnglish": "February is the second month.",
    "pronunciationNotes": "pe-BRE-ro",
    "culturalNotes": "",
    "excludeable": true
  },
  {
    "wordId": "months-03-marso",
    "tagalog": "Marso",
    "english": "March",
    "category": "time",
    "tags": ["months"],
    "recommendedGrade": 2,
    "difficultyLevel": 2,
    "frequency": "medium",
    "exampleSentenceTagalog": "Marso ang ikatlong buwan.",
    "exampleSentenceEnglish": "March is the third month.",
    "pronunciationNotes": "MAR-so",
    "culturalNotes": "",
    "excludeable": true
  },
  {
    "wordId": "months-04-abril",
    "tagalog": "Abril",
    "english": "April",
    "category": "time",
    "tags": ["months"],
    "recommendedGrade": 2,
    "difficultyLevel": 2,
    "frequency": "medium",
    "exampleSentenceTagalog": "Abril ang ikaapat na buwan.",
    "exampleSentenceEnglish": "April is the fourth month.",
    "pronunciationNotes": "A-bril",
    "culturalNotes": "",
    "excludeable": true
  },
  {
    "wordId": "months-05-mayo",
    "tagalog": "Mayo",
    "english": "May",
    "category": "time",
    "tags": ["months"],
    "recommendedGrade": 2,
    "difficultyLevel": 2,
    "frequency": "medium",
    "exampleSentenceTagalog": "Mayo ang ikalimang buwan.",
    "exampleSentenceEnglish": "May is the fifth month.",
    "pronunciationNotes": "MA-yo",
    "culturalNotes": "",
    "excludeable": true
  },
  {
    "wordId": "months-06-hunyo",
    "tagalog": "Hunyo",
    "english": "June",
    "category": "time",
    "tags": ["months"],
    "recommendedGrade": 2,
    "difficultyLevel": 2,
    "frequency": "medium",
    "exampleSentenceTagalog": "Hunyo ang ikaanim na buwan.",
    "exampleSentenceEnglish": "June is the sixth month.",
    "pronunciationNotes": "HU-nyo",
    "culturalNotes": "",
    "excludeable": true
  }
]