[
  {
    "wordId": "time-01-anong-oras",
    "tagalog": "Anong oras na?",
    "english": "What time is it?",
    "category": "time",
    "tags": ["time-questions"],
    "recommendedGrade": 1,
    "difficultyLevel": 2,
    "frequency": "high",
    "exampleSentenceTagalog": "Anong oras na?",
    "exampleSentenceEnglish": "What time is it?",
    "pronunciationNotes": "a-NONG o-RAS na",
    "culturalNotes": "",
    "excludeable": true
  },
  {
    "wordId": "time-02-umaga",
    "tagalog": "Umaga",
    "english": "Morning",
    "category": "time",
    "tags": ["time-of-day"],
    "recommendedGrade": 1,
    "difficultyLevel": 1,
    "frequency": "high",
    "exampleSentenceTagalog": "Magandang umaga.",
    "exampleSentenceEnglish": "Good morning.",
    "pronunciationNotes": "u-MA-ga",
    "culturalNotes": "",
    "excludeable": true
  },
  {
    "wordId": "time-03-tanghali",
    "tagalog": "Tanghali",
    "english": "Noon",
    "category": "time",
    "tags": ["time-of-day"],
    "recommendedGrade": 1,
    "difficultyLevel": 1,
    "frequency": "high",
    "exampleSentenceTagalog": "Tanghali na.",
    "exampleSentenceEnglish": "It's already noon.",
    "pronunciationNotes": "tang-HA-li",
    "culturalNotes": "",
    "excludeable": true
  },
  {
    "wordId": "time-04-hapon",
    "tagalog": "Hapon",
    "english": "Afternoon",
    "category": "time",
    "tags": ["time-of-day"],
    "recommendedGrade": 1,
    "difficultyLevel": 1,
    "frequency": "high",
    "exampleSentenceTagalog": "Magandang hapon.",
    "exampleSentenceEnglish": "Good afternoon.",
    "pronunciationNotes": "HA-pon",
    "culturalNotes": "",
    "excludeable": true
  },
  {
    "wordId": "time-05-gabi",
    "tagalog": "Gabi",
    "english": "Evening / Night",
    "category": "time",
    "tags": ["time-of-day"],
    "recommendedGrade": 1,
    "difficultyLevel": 1,
    "frequency": "high",
    "exampleSentenceTagalog": "Magandang gabi.",
    "exampleSentenceEnglish": "Good evening.",
    "pronunciationNotes": "GA-bi",
    "culturalNotes": "",
    "excludeable": true
  },
  {
    "wordId": "time-06-kahapon",
    "tagalog": "Kahapon",
    "english": "Yesterday",
    "category": "time",
    "tags": ["time-reference"],
    "recommendedGrade": 1,
    "difficultyLevel": 2,
    "frequency": "high",
    "exampleSentenceTagalog": "Kahapon pa.",
    "exampleSentenceEnglish": "It was yesterday.",
    "pronunciationNotes": "ka-HA-pon",
    "culturalNotes": "",
    "excludeable": true
  },
  {
    "wordId": "time-07-ngayon",
    "tagalog": "Ngayon",
    "english": "Today / Now",
    "category": "time",
    "tags": ["time-reference"],
    "recommendedGrade": 1,
    "difficultyLevel": 1,
    "frequency": "high",
    "exampleSentenceTagalog": "Ngayon na.",
    "exampleSentenceEnglish": "Now.",
    "pronunciationNotes": "nga-YON",
    "culturalNotes": "",
    "excludeable": true
  },
  {
    "wordId": "time-08-bukas",
    "tagalog": "Bukas",
    "english": "Tomorrow",
    "category": "time",
    "tags": ["time-reference"],
    "recommendedGrade": 1,
    "difficultyLevel": 1,
    "frequency": "high",
    "exampleSentenceTagalog": "Bukas na lang.",
    "exampleSentenceEnglish": "Tomorrow.",
    "pronunciationNotes": "BU-kas",
    "culturalNotes": "",
    "excludeable": true
  }
]